id,questions
5d08,"Is it possible to use frozen chicken breast for this recipe, and if so, how should I adjust the cooking time?"
181c,Can I use chicken thighs instead of pork chops for the Japanese Noodle Soup recipe?
181c,What can I substitute for soy sauce if I'm looking for a gluten-free option?
181c,How do I make the broth more spicy without adding too many calories?
181c,Are there any recommended vegetables to add for extra nutrition in the noodle soup?
181c,Can I prepare the broth in advance and store it for later use in the Japanese Noodle Soup?
cb85,Can I use ground turkey instead of ground beef for the taco meat recipe?
cb85,What can I substitute for fresh tomato if I only have tomato sauce on hand?
cb85,"How spicy is this taco meat recipe, and can I adjust the heat level?"
cb85,Is there a way to make this taco meat gluten-free?
cb85,"What toppings do you recommend for serving the taco meat, based on the recipe?"
a118,"What type of crab meat do you recommend using for the crab salad, and does it need to be cooked or can I use pre-cooked crab?"
a118,Can I substitute mayonnaise with a healthier option or a different dressing for the crab salad?
a118,Is there a way to make this crab salad more protein-packed without altering the taste too much?
a118,What can I serve alongside the crab salad to create a complete meal?
a118,"Is it possible to add any other ingredients to the crab salad for extra flavor or texture, and if so, what would you suggest?"
9eeb,What is the significance of the Santiago cross that is dusted on top of the Tarta de Santiago?
9eeb,"Can I substitute any of the ingredients if I have allergies, such as using a different type of flour instead of almond meal?"
9eeb,Is there a way to make the Tarta de Santiago gluten-free or vegan while still maintaining its flavor?
9eeb,"What variations can I make to the recipe to serve it with a different flavor profile, like adding chocolate or other spices?"
9eeb,How can I ensure that my Tarta de Santiago has the perfect texture and doesn't turn out too dry or too moist?
9717,"What type of onion should I use for the Zarangollo, and how finely should I cut it?"
9717,"Can I substitute the eggplant with another vegetable, and if so, which one works best?"
9717,"Is it necessary to use olive oil for cooking, or can I use another type of oil instead?"
9717,How do I know when the eggplant and onion are tender and caramelized enough for serving?
9717,What are some good side dishes or accompaniments to serve alongside Zarangollo?
c0fd,What can I substitute for plain yogurt if I want a dairy-free option in the Chicken Tikka Masala?
c0fd,"Can I use chicken thighs instead of chicken breasts for this recipe, and would the cooking time change?"
c0fd,How can I adjust the spice level in this Chicken Tikka Masala if I prefer it milder?
c0fd,"Is it possible to prepare the Chicken Tikka Masala in a regular pot instead of a slow cooker, and if so, how would the cooking time differ?"
c0fd,"What type of rice pairs best with this dish, and can I use brown rice instead of basmati rice?"
71f5,Can I substitute the eggs in the Bolinhos de Coco recipe for something vegan-friendly?
71f5,How can I adjust the sweetness of the Bolinhos de Coco if I prefer a less sweet dessert?
71f5,What type of coconut should I use for the best flavor in the Bolinhos de Coco?
71f5,"Can I add any other flavors or ingredients to the Bolinhos de Coco, like chocolate or fruit?"
71f5,What is the best way to store leftover Bolinhos de Coco to keep them fresh?
f6c2,What is the ideal temperature for the water when making the Challah Bread?
f6c2,"Can I substitute honey with another sweetener, and if so, how much should I use?"
f6c2,"Is it necessary to use poppy seeds for the topping, or can I choose a different seed?"
f6c2,How long should I let the dough rise if I live in a colder climate?
f6c2,What is the best way to store leftover Challah Bread to keep it fresh?
294d,How can I adjust the spice level of the Red Lentil Dahl if I prefer it less spicy?
294d,Can I make the Red Lentil Dahl vegan by omitting any specific ingredients?
294d,What can I use as a substitute for Yellow Curry if I can't find it at the store?
294d,"How do I store leftovers of Red Lentil Dahl, and how long will it last in the fridge?"
294d,Is there a way to make this dish gluten-free while maintaining the same flavors?
00d5,Can I substitute the sardines with another type of fish for these sardine cakes?
00d5,What adjustments should I make to the recipe if I prefer a milder flavor instead of spicy?
00d5,How can I make the Spicy Yogurt Sauce creamier without losing the flavor?
00d5,Are there any recommended side dishes that pair well with the sardine cakes?
00d5,"What is the best way to store leftovers from the sardine cakes, and how long will they last?"
7117,How can I adjust the spice level of the Potato and Eggplant Curry to make it milder for kids?
7117,What type of rice pairs best with this Potato and Eggplant Curry to complement the flavors?
7117,Can I substitute the coconut milk with another ingredient if I am lactose intolerant?
7117,Is there a way to make this Potato and Eggplant Curry vegan-friendly if I want to avoid paneer?
7117,What optional vegetables do you recommend adding to the curry for extra nutrition without changing the flavor too much?
9dc8,What type of milk is best to use for making yogurt?
9dc8,Can I use flavored yogurt instead of plain yogurt for the starter?
9dc8,How long can I store homemade yogurt in the fridge before it goes bad?
9dc8,Is there a specific temperature I should maintain during the 12-hour incubation period?
9dc8,Can I use a different method instead of a thermos to ferment the yogurt?
9b0a,What type of flour is best to use for the crust in the Smoked Salmon Quiche?
9b0a,Can I substitute the whipping cream with a lower-fat option for a healthier version of the quiche?
9b0a,How can I adjust the recipe if I want to use fresh salmon instead of smoked salmon?
9b0a,What are some good side dishes that pair well with the Smoked Salmon Quiche for a brunch?
9b0a,"Is it possible to make the quiche without onions, and what can I use as a substitute?"
1b5a,What can I substitute for heavy cream if I want a lighter version of the Tomato and Grilled Bell Pepper soup?
1b5a,"Can I use fresh herbs instead of bruschetta herbs for this soup, and if so, which ones would you recommend?"
1b5a,How can I adjust the spice level if I find the cayenne pepper too spicy for my taste?
1b5a,Is there a vegetarian option for the stock or broth that I can use in this recipe?
1b5a,What is the best way to freeze and reheat the soup to maintain its flavor and texture?
a875,Can I use canned tuna in olive oil instead of water for the Simple Tuna Salad recipe?
a875,What type of cheese pairs best with the Simple Tuna Salad if I choose to include it?
a875,Is there a way to make the Simple Tuna Salad spicier for those who enjoy a kick in their dishes?
a875,"Can I substitute Greek yogurt for mayonnaise in the Simple Tuna Salad, and will it change the flavor significantly?"
a875,How can I make the Simple Tuna Salad more filling without adding too many calories?
2036,Can I substitute the melted butter with a dairy-free alternative to make these chocolate chip cookies vegan?
2036,What should I do if I want my cookies to be chewier rather than crunchy?
2036,Is it possible to use whole wheat flour instead of bread flour for a more nutritious option?
2036,How do I store the chocolate chip cookies to keep them fresh for longer?
2036,"Can I add nuts or other mix-ins to the cookie dough, and if so, how much should I add?"
46e9,What type of pork do you recommend for the Merchant's Buckwheat recipe?
46e9,Can I substitute the buckwheat with another grain if I can't find it?
46e9,How can I adjust the spiciness of the dish if I prefer it to be milder?
46e9,Is there a vegetarian version of Merchant's Buckwheat that I can try?
46e9,What side dishes pair well with Merchant's Buckwheat to make a complete meal?
a838,Can I substitute the medium squash for another vegetable if I don't have it on hand?
a838,"What type of milk works best for the Autumn Soup, and can I use a non-dairy alternative?"
a838,Is there a way to make this soup vegan-friendly while keeping it flavorful?
a838,How can I ensure the vegetables are cooked perfectly without burning them if I choose to cook them on the stove instead of baking?
a838,What are some recommended toppings or garnishes to enhance the flavor of the Autumn Soup before serving?
afc1,What type of sweet potato is best to use for Bolo do Caco to ensure the right texture?
afc1,Can I substitute any of the all-purpose flour with whole wheat or gluten-free flour in this Bolo do Caco recipe?
afc1,How do I know when the dough has fermented properly after the 3-day rest in the refrigerator?
afc1,What are some tasty toppings I can use besides salted butter and parsley when serving Bolo do Caco?
afc1,"Is it possible to freeze leftover Bolo do Caco, and if so, how should I reheat them?"
e4e5,What can I use as a substitute for baker’s ammonium in the Greek Easter Cookies recipe?
e4e5,Can I use whole eggs instead of just egg yolks for brushing on top of the cookies?
e4e5,What kind of flour works best for making these Greek Easter Cookies to ensure a soft dough?
e4e5,How can I adjust the recipe if I want to make a smaller batch of these cookies?
e4e5,Are there any recommended ways to decorate these cookies for Easter before baking them?
3363,What can I substitute for shortening in the Scandinavian Coffee Cake recipe if I want a dairy-free option?
3363,How can I adjust the sweetness of the cake if I want it less sweet than the traditional recipe calls for?
3363,"Is it possible to make this Scandinavian Coffee Cake gluten-free, and if so, what flour should I use?"
3363,Can I add any other nuts or fruits to the cake for additional flavor?
3363,How should I store the leftovers of the Scandinavian Coffee Cake to keep it fresh for longer?
6372,Can I use dark chocolate powder instead of regular cocoa powder for the Brigadeiro?
6372,How long does it take to prepare Brigadeiro from start to finish?
6372,What can I use as a substitute for butter if I want a dairy-free version of Brigadeiro?
6372,Is there a specific type of sprinkles recommended for rolling the Brigadeiro balls?
6372,What is the best way to store leftover Brigadeiro if I make a large batch?
41ea,Can I use a different type of cookie for the crust instead of buttered cookies?
41ea,What can I substitute for margarine if I want a dairy-free option?
41ea,Is there a specific brand of condensed milk that works best with this recipe?
41ea,How can I prevent the meringue from weeping or becoming soggy after baking?
41ea,What other fruits could I use to create a variation of this lemon meringue pie?
e21d,"What type of flour should I use for the sourdough starter, wheat or rye, and does it affect the flavor of the bread?"
e21d,How long does it typically take for the starter to become bubbly and active enough for baking?
e21d,What should I do if my sourdough starter doesn't show any bubbles after Day 2?
e21d,"How do I properly store my sourdough starter once it's been made, and how long can it last in the fridge?"
e21d,What is the best method to reactivate a sourdough starter that has been stored in the fridge for an extended period?
c26b,How can I make the chicken satay spicier if I prefer a bit more heat?
c26b,What can I substitute for oyster sauce if I'm trying to avoid it?
c26b,"Is it possible to make the peanut sauce ahead of time, and how should I store it?"
c26b,Can I use tofu or another protein instead of chicken for this recipe?
c26b,What are some side dishes that pair well with chicken satay and peanut sauce?
59f7,"What type of spaghetti is best for making Cacio e Pepe, and can I use a different pasta type if I prefer?"
59f7,How can I adjust the level of spice in my Cacio e Pepe without changing the overall flavor significantly?
59f7,Is there a way to make Cacio e Pepe creamier if I find the standard recipe too dry?
59f7,"Can I substitute Pecorino Romano with another cheese, and how will that affect the taste of the dish?"
59f7,How long should I toast the peppercorns to get the best flavor for my Cacio e Pepe?
4694,"Can I use frozen chicken instead of fresh for the Chicken, Tomato and Spinach Curry, and would it affect the cooking time?"
4694,"What type of curry powder do you recommend for a milder flavor in the Chicken, Tomato and Spinach Curry?"
4694,"Is there a way to make this Chicken, Tomato and Spinach Curry dairy-free, and should I use coconut milk?"
4694,"Can I add other vegetables to the Chicken, Tomato and Spinach Curry for extra nutrition without changing the flavor too much?"
4694,"What can I serve alongside the Chicken, Tomato and Spinach Curry for a complete meal, considering I’m looking for healthy options?"
0166,What alternative ingredients can I use if I don't have fresh tomatoes for the Ratatouille?
0166,"Can I make this Ratatouille dish spicy, and if so, how would you suggest I do that?"
0166,What are some recommended side dishes to serve with my Ratatouille?
0166,How can I adjust the cooking time if I want to double the recipe for a larger gathering?
0166,"What is the best way to store leftover Ratatouille, and how long will it last in the refrigerator?"
64e1,What can I substitute for miso paste if I can't find it at the store?
64e1,Can I use brown rice instead of sushi rice for the Miso Ginger Pork dish?
64e1,What is the best way to pickle the daikon quickly?
64e1,Is there a vegetarian alternative for the ground pork in this recipe?
64e1,How can I adjust the recipe to make it spicier without overpowering the other flavors?
4110,What type of seafood can I use to make ceviche besides tilapia?
4110,How long should I let the ceviche sit in the fridge for optimal flavor?
4110,"Can I add other ingredients like tomatoes or cilantro to the cerviche, and how would that change the flavor?"
4110,Is there a specific method for cutting the seafood to achieve the best texture in the ceviche?
4110,What is the ideal ratio of lime juice to seafood for balancing the flavors in the ceviche?
2da7,What can I serve as a side dish with the marinated pork steaks to complement their flavors?
2da7,How long can I marinate the pork steaks for maximum flavor without overdoing it?
2da7,Can I substitute any ingredients in the marinade if I'm allergic to soy sauce or honey?
2da7,What grilling techniques should I use to ensure the pork steaks are cooked evenly without drying out?
2da7,Is there a recommended wine pairing for the marinated pork steaks to enhance the dining experience?
4b5c,"What type of pasta works best for the Spicy Sausage Pasta, or can I substitute with another kind?"
4b5c,"Can I make Spicy Sausage Pasta less spicy? If so, what adjustments should I make?"
4b5c,Is there a way to make this dish healthier or more nutritious while keeping the flavors intact?
4b5c,"How long can I store leftovers of the Spicy Sausage Pasta, and what's the best way to reheat it?"
4b5c,"What type of red wine is recommended for cooking in this recipe, or can I use a different kind of wine?"
ff3b,"What type of cheese works best for this pan pizza recipe, and can I use a combination of different cheeses?"
ff3b,How can I make the crust even crispier when baking the pan pizza?
ff3b,Can I use a gluten-free dough recipe instead of the no-knead pizza dough for this pan pizza?
ff3b,What temperature should I set the oven to if my oven doesn't have a max temperature option?
ff3b,Are there any alternative toppings you recommend for someone who doesn't like pepperoni or mushrooms?
f261,What can I substitute for Shaoxing wine if I don't have it on hand?
f261,Can I use frozen broccoli instead of fresh for this Hoisin Tofu and Broccoli recipe?
f261,How can I adjust the recipe to reduce the sodium content for a low-sodium diet?
f261,What other vegetables could I add to this dish for extra nutrition and flavor?
f261,Is there a way to make this dish spicy if I enjoy heat in my meals?
8ede,Can I use vegetable stock instead of chicken stock in the curry sauce recipe?
8ede,What type of curry powder do you recommend for the best flavor in this recipe?
8ede,Is there a way to make this curry sauce spicier if I prefer more heat?
8ede,"How long can I keep the frozen curry sauce, and is there a specific reheating method you suggest?"
8ede,Can I substitute the butter with olive oil or another type of fat for a healthier option?
1a4d,"What types of bread work best for making garlic toast, and can I use gluten-free options?"
1a4d,"Can I make garlic toast without garlic-infused olive oil, and what other alternatives can I use?"
1a4d,How can I adjust the cooking time if I want my garlic toast to be softer instead of crunchy?
1a4d,What are some creative toppings or pairings I can use with garlic toast besides cheese and dips?
1a4d,"Can I prepare garlic toast in advance and reheat it later, and if so, what is the best way to store it?"
52d1,"What is the ideal butter-to-chicken ratio for making Pozharskiye Cutlets, and can I adjust it based on my dietary preferences?"
52d1,Can I substitute the white bread with a gluten-free alternative for the breadcrumbs in Pozharskiye Cutlets?
52d1,What spices or seasonings do you recommend adding to enhance the flavor of the Pozharskiye Cutlets?
52d1,How can I adjust the cooking time if I decide to make larger cutlets instead of the standard size?
52d1,Is there a recommended sauce to pair with Pozharskiye Cutlets that complements their creamy texture?
abc1,What alternative shellfish can I use instead of lobster in this bisque if I'm looking for a different flavor?
abc1,"Can I make this lobster bisque ahead of time, and if so, how should I store it and reheat it later?"
abc1,What type of dry white wine do you recommend for this recipe to enhance the flavors?
abc1,Is there a way to make the bisque lighter or healthier while still keeping it creamy?
abc1,How can I adjust the recipe if I want to make a smaller or larger batch of lobster bisque?
088e,"What type of cheese is recommended for Spaghetti all'amatriciana, and can I substitute it with another cheese if I don't have it?"
088e,How spicy will the dish be if I choose to add multiple fresh chili peppers?
088e,"Is it necessary to use guanciale, or can I use regular bacon instead, and how would it affect the flavor?"
088e,How do I know when the white wine has cooked off and the alcohol evaporated during preparation?
088e,Can I prepare the sauce in advance and reheat it before adding it to the pasta for serving?
c746,What is the best way to store leftover Yorkshire Puddings if I want to keep them for later?
c746,Can I substitute sunflower oil with another type of oil or fat for frying in the cupcake tin?
c746,How can I ensure my Yorkshire Puddings rise perfectly every time?
c746,Are there any recommended variations or seasonings I can add to the batter for a different flavor?
c746,What type of oven should I use for making Yorkshire Puddings: fan-assisted or conventional?
7e7f,"What specific type of lentils should I use for the Sopa de Lentejas, or can I use different varieties?"
7e7f,Is there a vegetarian option for the Sopa de Lentejas if I want to omit the chorizo?
7e7f,Can I substitute other vegetables in the Sopa de Lentejas if I don't have carrots or bell pepper on hand?
7e7f,How can I adjust the spice level of the Sopa de Lentejas without making it too overpowering?
7e7f,What can I serve as a side dish with the Sopa de Lentejas to make it a complete meal?
7bee,What can I substitute for the chicken thighs if I want a leaner option?
7bee,"Can I make this dish vegetarian, and if so, what are the best substitutions for the chicken and sauces?"
7bee,"How spicy is the dish with the amount of chili garlic sauce called for, and can I adjust it for a milder flavor?"
7bee,"What type of peanuts can I use in this recipe, and is there an alternative for those with nut allergies?"
7bee,"Can I prepare the rice in a rice cooker, and how would I adjust the water and time for optimal results?"
8ee9,Can I substitute the smoked duck with another type of meat or a vegetarian option for this Collard Greens with Smoked Duck and Parsnips recipe?
8ee9,What adjustments should I make to the seasoning if I prefer a spicier version of the dish?
8ee9,"Is it possible to prep the collard greens and other ingredients ahead of time for this recipe, and if so, how far in advance?"
8ee9,What kind of crusty bread would pair best with this dish if I'm planning to serve it as an entree?
8ee9,"How long can I store leftovers of the Collard Greens with Smoked Duck and Parsnips, and what is the best way to reheat them?"
3844,Can I use cottage cheese instead of ricotta for the lasagna filling?
3844,What type of parmesan cheese is best to use in the ricotta lasagna filling?
3844,Is it possible to make the ricotta filling ahead of time and store it in the fridge?
3844,Are there any recommended herbs or spices that I can add to the ricotta filling for extra flavor?
3844,How can I adjust this recipe if I want to make a vegan version of the ricotta lasagna filling?
fe10,"What type of cream is best for this creamy pasta sauce, and does the fat content make a difference?"
fe10,"Can I use whole wheat flour instead of regular wheat flour for this sauce, and would it alter the taste?"
fe10,How can I adjust the sauce if it becomes too thick while cooking?
fe10,Are there any specific pasta types that pair best with this creamy sauce?
fe10,Is it possible to add any additional ingredients or seasonings to enhance the flavor of this sauce?
bcf9,Can I use a different type of cheese instead of cheddar for the Cheddar-Crusted Chicken?
bcf9,What can I substitute for mayonnaise if I'm looking for a healthier option?
bcf9,Are there any specific seasoning tips you recommend to enhance the flavor of the chicken?
bcf9,How can I adjust the cooking time if I decide to use thicker chicken breasts?
bcf9,What other sides could I pair with the Cheddar-Crusted Chicken besides roasted green beans and mashed sweet potatoes?
c435,What can I use instead of chicken bouillon for a vegetarian version of the Colcannon Bake?
c435,"Can I substitute the sour cream with a dairy-free alternative, and will it affect the taste?"
c435,"Is there a way to make the Colcannon Bake spicier, perhaps by adding some herbs or spices?"
c435,"How do I store leftovers of the Colcannon Bake, and how long will they stay fresh in the fridge?"
c435,What sides would you recommend serving with Colcannon Bake to make it a complete meal?
79cc,"Can I use only beef mince instead of the mix of beef, pork, and veal for the Bolognese sauce?"
79cc,What type of wine works best for deglazing the pan and enhancing the flavor of the sauce?
79cc,"How can I adjust the recipe for a vegan version, especially considering the meat and milk?"
79cc,"Is it necessary to add pancetta, and what can I substitute if I prefer not to use it?"
79cc,What are some recommended pasta dishes or lasagne recipes that pair well with this Bolognese sauce?
dde1,"What kind of spices do you recommend for the Chilli con Carne, considering I prefer a mild flavor?"
dde1,Can I use lean pork mince instead of non-lean for this Chilli con Carne recipe?
dde1,What type of chilis should I use if I want a spicier version of Chilli con Carne?
dde1,"Is there a substitute for the wine in the recipe, or can I omit it altogether?"
dde1,How can I adjust the cooking time if I want to make a larger batch of Chilli con Carne?
a02b,What kind of sausages should I use for an authentic Full English Breakfast?
a02b,How do I properly cook the bacon to ensure it's crispy?
a02b,Can I use canned baked beans or do they need to be homemade?
a02b,What is the best way to prepare the mushrooms for cooking?
a02b,How should I serve the eggs to make them fluffy in the Full English Breakfast?
235f,How can I customize the spices in the cooked chickpeas recipe if I want a milder flavor?
235f,What are some good dishes or meals that I can pair the cooked chickpeas with if I'm following a vegetarian diet?
235f,"Can I use dried chickpeas instead of canned ones, and if so, how would I adjust the cooking time?"
235f,Is there a way to make the cooked chickpeas a bit crispy while cooking them?
235f,"What is the best way to store leftover cooked chickpeas, and how long will they last in the fridge?"
3b1c,What can I use instead of olive oil in the lemon juice salad dressing?
3b1c,How can I make this lemon juice salad dressing vegan-friendly?
3b1c,Can I add any herbs to the dressing for extra flavor?
3b1c,How long can I store the lemon juice salad dressing in the fridge?
3b1c,What type of salad greens pair best with this lemon juice salad dressing?
2e55,Can I use sweet potatoes instead of regular potatoes for the Country Breakfast Skillet?
2e55,What other types of cheese can I substitute for Gouda in this recipe?
2e55,How can I make the Country Breakfast Skillet spicier?
2e55,Is there a way to prepare this dish in advance and reheat it later?
2e55,Can I make a vegetarian version of the Country Breakfast Skillet without losing the flavor?
c5d4,How can I make my oats taste sweeter without adding too much sugar?
c5d4,What are some other fruits I can add to my oats besides banana and berries?
c5d4,Can I prepare oats in advance for quick breakfasts during the week?
c5d4,How do I adjust the cooking time if I'm using quick oats instead of rolled or steel cut oats?
c5d4,What are the nutritional benefits of adding peanut butter to my oats?
4b60,What can I substitute for St. Augur blue cheese if I prefer a milder flavor?
4b60,How can I ensure the butternut squash is cooked evenly during roasting?
4b60,Are there any recommended spices or herbs to enhance the flavor of the Savory Squash?
4b60,Can I prepare the Savory Squash in advance and reheat it later?
4b60,What other dishes pair well with Savory Squash as a side?
