id,questions
d8c7,"How can I adjust the recipe to make it vegetarian-friendly, especially considering the use of yogurt and butter?"
d8c7,"What type of yogurt works best for the Turkish Yogurt Soup, and can I substitute it with a non-dairy yogurt?"
d8c7,Is there a gluten-free alternative to the flour used in the recipe?
d8c7,"Can I add any vegetables to the soup, and if so, which ones would complement the dish well?"
d8c7,How can I make this soup spicier for those who enjoy a bit of heat in their dishes?
c8c5,What type of oranges are best to use for making this orange jam?
c8c5,"Can I reduce the amount of sugar in the recipe, or will it affect the consistency?"
c8c5,"How long can I store this orange jam once it's made, and does it need refrigeration?"
c8c5,Is there a recommended way to use this orange jam besides spreading it on mazurek?
c8c5,Can I add any other fruits or spices to this orange jam recipe for added flavor?
190f,What are some traditional side dishes that pair well with Erwtensoep?
190f,"Can I make a vegetarian version of Erwtensoep, and if so, what substitutions would you recommend for the meat?"
190f,"How can I adjust the recipe if I want to make a smaller portion, say for 2 servings instead of 4?"
190f,What tips do you have for achieving the perfect consistency in my Erwtensoep—should I leave it chunky or blend it smooth?
190f,"Is there a specific type of smoked sausage that is best for this recipe, or can I use any smoked sausage I have on hand?"
0aea,"What is the best type of alcohol to use for the Grostoli recipe, and can I substitute it with something non-alcoholic?"
0aea,How do I ensure that the Grostoli fries correctly and stays crispy for longer?
0aea,"Can I make Grostoli using gluten-free flour, and if so, how would that affect the recipe?"
0aea,What is the recommended way to store Grostoli after making them to maintain freshness?
0aea,Is there a way to adjust the sweetness of the Grostoli if I prefer them less sweet?
6912,Can I substitute chicken broth with vegetable broth for a vegetarian version of Ukrainian Borscht?
6912,What adjustments should I make if I want a spicier version of Borscht?
6912,Is it possible to prepare Borscht in advance and reheat it later?
6912,"How do I store leftover Borscht, and how long will it last in the fridge?"
6912,What variations can I make to include more protein in the Borscht recipe?
bde1,"What type of octopus should I use for Pulpo a la gallega, and do you recommend any specific preparation method prior to boiling?"
bde1,Can I use any substitute for the sweet and spicy red pepper if I can't find it?
bde1,How should I adjust the cooking time if my octopus is smaller than 1.7kg?
bde1,What’s the best way to ensure the potatoes are cooked perfectly to complement the octopus?
bde1,Are there any recommended side dishes or beverages that pair well with Pulpo a la gallega?
71ab,Can I substitute the caster sugar with regular granulated sugar for the Pavlova recipe?
71ab,"What types of fresh fruit pair best with Pavlova, and can I use frozen fruit instead?"
71ab,"Is it necessary to use vinegar in the meringue, or can I omit it for a different flavor?"
71ab,What is the best way to cool the Pavlova after baking to prevent it from cracking?
71ab,"Can I make the Pavlova in advance, and how should I store it if I do?"
1b8b,What is the best way to choose the right size round squash for stuffing?
1b8b,Can I substitute the rice with a different grain or a low-carb alternative?
1b8b,"What kind of cheese works best with the stuffed round squash, and can I skip it altogether?"
1b8b,How can I add more flavor to the vegetable mixture besides seasoning?
1b8b,"Is it possible to prepare the stuffed round squash ahead of time, and how should I store it?"
52fc,Can I use a different type of hot sauce instead of Frank's RedHot for my chicken wings?
52fc,What is the recommended marinade time for the wings to get the best flavor?
52fc,Is there a way to make these wings crispy if I don't have a grill?
52fc,How can I adjust the spiciness of the wings if my family prefers mild flavors?
52fc,What side dishes pair well with buffalo chicken wings for a complete meal?
4003,"What type of bread works best for making croutons, and can I use whole grain instead of white bread?"
4003,Are there any recommended spice combinations for croutons that would complement a Caesar salad?
4003,How long will homemade croutons stay fresh if I store them in a sandwich bag?
4003,"Can I make croutons in advance for meal prep, and if so, how should I reheat them?"
4003,"Is it possible to make croutons without olive oil, and what alternatives could I use to keep them flavorful?"
a538,"What type of bread works best for making French toast, or can I use any bread I have at home?"
a538,Can I substitute the milk with a non-dairy alternative like almond or soy milk for the French toast recipe?
a538,How can I make my French toast healthier while still keeping it delicious?
a538,What can I do if I don’t have maple syrup? Are there any good alternatives?
a538,"Is it possible to prepare the egg and milk mixture in advance, and how long can it be stored before using?"
96e6,What can I use as a substitute for the vanilla bean in the Dulce de Leche recipe if I don’t have any?
96e6,How long does the Dulce de Leche need to be stored in the fridge before it goes bad?
96e6,Can I use low-fat milk instead of whole milk for making Dulce de Leche?
96e6,"What is the purpose of the glass marbles in the cooking process, and are they necessary?"
96e6,Is there a way to speed up the cooking process for Dulce de Leche without compromising the flavor?
c72e,"What type of flour is used for the pizza dough, and can I make it gluten-free?"
c72e,Can you suggest a substitute for the bacon if I'd like a vegetarian version of Flammkuchen?
c72e,"Is there a specific type of onion that enhances the flavor of the Flammkuchen, or can I use any onion I have on hand?"
c72e,"Can I prepare the Flammkuchen in advance and reheat it later, or is it best to eat it fresh out of the oven?"
c72e,What are some recommended side dishes or drinks that pair well with Flammkuchen to complete the meal?
c735,"Can I substitute the firm tofu with another protein option like chicken or shrimp, and how would that change the cooking time?"
c735,What brands of soy sauce and oyster sauce do you recommend for the best flavor in this Tofu and Cashew Chow Mein?
c735,Is there a vegetarian alternative to oyster sauce that I can use while still maintaining a similar flavor profile?
c735,How can I make this dish spicier without overwhelming the other flavors?
c735,"What can I use instead of roasted cashews if I have a nut allergy, and will it still taste good in the dish?"
cbc2,Can I use coconut oil instead of vegetable oil for making Kettle Corn?
cbc2,What should I do if my Kettle Corn is tasting too salty?
cbc2,How can I adjust the recipe to make a larger batch of Kettle Corn?
cbc2,Is it possible to use granulated sugar instead of brown sugar for this recipe?
cbc2,What type of saucepan do you recommend for making Kettle Corn to prevent burning?
95dc,"What specific type of meat is best for fajitas, chicken or skirt steak, and does it affect the flavor?"
95dc,How can I make the fajitas spicier without losing the other flavors?
95dc,"Can I prepare the marinade for the fajitas in advance, and if so, how long can it be stored?"
95dc,Are there any suggested toppings or sides that would complement the fajitas beyond what is mentioned in the recipe?
95dc,What changes can I make if I prefer a vegetarian version of fajitas?
0d31,What can I use as a substitute for unsalted butter in the Kropsua recipe if I have dietary restrictions?
0d31,"Can I use a non-dairy milk alternative instead of whole milk for making Kropsua, and will it affect the texture?"
0d31,How can I adjust the sugar amount for Kropsua if I'm trying to reduce my sugar intake?
0d31,"What is the best way to serve Kropsua alongside coffee, sausage, or fresh fruit for a balanced breakfast?"
0d31,"Can I make Kropsua in advance and reheat it, and if so, what is the best method to maintain its texture?"
ff83,What type of tomatoes do you recommend for making the salsa from scratch?
ff83,Can I use a different type of onion if I don't have red or green onions?
ff83,How spicy will the salsa be if I decide to omit the jalapeño pepper?
ff83,"Is it necessary to add lime juice to the salsa, or can I leave it out for a different flavor?"
ff83,How long can I keep the salsa in the refrigerator before it goes bad?
c343,What can I use as a substitute for vermicelli in the Lenten Lentil Curry?
c343,How can I adjust the spice level of this dish if I prefer it less spicy?
c343,Are there any additional vegetables I can add to the Lenten Lentil Curry for more nutrition?
c343,"Can I make this dish in a slow cooker, and if so, how would I adjust the cooking time?"
c343,Is it possible to make this Lenten Lentil Curry ahead of time and reheat it later?
430d,Can I substitute the sausages with a vegetarian option in the Breakfast Wrap?
430d,What type of wraps work best for this Breakfast Wrap?
430d,I have a lactose intolerance; can I make the scrambled egg without milk?
430d,How can I add more vegetables to the Breakfast Wrap for a healthier option?
430d,"Is there a way to make this Breakfast Wrap spicy, and what ingredients should I use?"
5081,"What type of peanuts should I use to make the peanut butter, and do I need to worry about their quality?"
5081,Can I add any sweeteners or flavorings to the peanut butter during the processing step?
5081,"How long can I store the homemade peanut butter, and what is the best way to keep it fresh?"
5081,"Is it possible to make the peanut butter without a food processor, and if so, what alternative methods could I use?"
5081,"Are there any specific dietary concerns I should consider when making and consuming peanut butter, especially during fasting?"
1b74,"What type of meat do you recommend for the best flavor in the traditional Irish stew, beef or lamb?"
1b74,"Can I use other vegetables besides onion, celery, carrot, and garlic in this stew?"
1b74,"How do I ensure the stew is not too watery after cooking, and what can I do to thicken it?"
1b74,"Is there a specific type of stout or porter that's best to use for this recipe, and how much should I add?"
1b74,"Can I make this stew in a slow cooker instead of on the stovetop, and if so, what adjustments should I make to the cooking time?"
857d,What can I substitute for the mozzarella cheese if I prefer a dairy-free option?
857d,Can I use gluten-free flour instead of wholemeal wheat flour for the pizza dough?
857d,What is the best way to ensure my pizza crust turns out crispy?
857d,How can I make this pizza more spicy? Are there specific ingredients I should add?
857d,What other topping combinations do you recommend for someone who doesn't like salami or ham?
3e67,How can I ensure the chicken skin is extra crispy in my Chicken Paprikash?
3e67,What kind of bread pairs well with Chicken Paprikash?
3e67,Can I substitute sour cream with a non-dairy alternative in this recipe?
3e67,What can I use if I don't have Hungarian paprika on hand?
3e67,"Is it possible to use skinless chicken thighs, and if so, how would that affect the cooking time?"
b490,"What type of liver can I use for this pâté, and do you recommend chicken or beef liver for beginners?"
b490,"Can I substitute any of the ingredients, like using a different type of fat instead of butter or ghee?"
b490,How can I adjust the spices to cater to my taste preferences? I prefer a milder flavor. 
b490,"What is the best way to store the liver pâté after I've made it, and how long will it stay fresh?"
b490,Could you suggest some serving ideas or accompaniments that pair well with liver pâté?
e639,What type of Irish cream liqueur do you recommend for making Irish Coffee?
e639,"Can I use decaf coffee instead, and will it affect the taste of the Irish Coffee?"
e639,Is there a particular brand of Irish whiskey that complements this drink best?
e639,What alternative toppings can I use instead of whipped cream for a dairy-free version?
e639,"Can I prepare Irish Coffee in larger batches for a gathering, and if so, how would I adjust the ingredient quantities?"
868b,What cooking method do I use for the chicken in the Honey Garlic Chicken recipe?
868b,Can I substitute the brown rice with another type of rice for this dish?
868b,How can I adjust the recipe if I want to make it for four servings instead of two?
868b,Is there a way to meal prep the Honey Garlic Chicken with Broccoli and Brown Rice for the week?
868b,What can I add to the dish if I want to increase the protein content further?
0de5,What type of chicken should I use for the Galinha Caipira to avoid a greasy stew?
0de5,How can I adjust the cooking time if I want to make a larger batch for more than five servings?
0de5,"Are there any specific types of onions that work best for this dish, or can I use any kind?"
0de5,What can I serve alongside Galinha Caipira to enhance the meal experience?
0de5,"Can I substitute the lard with a different cooking fat, and if so, which one would be best for this recipe?"
47e8,"What type of lamb cut is best for making Tuh'u stew, and does it affect the flavor?"
47e8,Can I substitute the sour-tasting beer with a different type of alcohol or a non-alcoholic alternative?
47e8,What can I use instead of arugula if I can't find it at my grocery store?
47e8,"Is it necessary to use both types of leeks mentioned in the recipe, or can I use just one?"
47e8,How can I adjust the cooking time if I want my lamb to be more tender in the Tuh'u?
d2b8,"What type of tuna should I use for the Tuna Sub, oil-packed or water-based?"
d2b8,"Can I customize the toppings for the Tuna Sub, and what are some suggestions?"
d2b8,How do I make my own tuna salad from scratch for the Tuna Sub?
d2b8,"Is it possible to substitute the sandwich bun with something else, like lettuce wraps or whole grain bread?"
d2b8,What are some good side dishes or snacks that pair well with the Tuna Sub?
207f,What type of potatoes work best for making fried potatoes?
207f,Can I use a different kind of oil besides what's recommended in the recipe?
207f,How can I make fried potatoes crispier without burning them?
207f,Is there a recommendation for seasoning the fried potatoes to enhance flavor?
207f,Can I add other vegetables to the dish along with the potatoes and onions?
c9f2,What type of white fish is best to use for the Fish Curry recipe?
c9f2,Can I substitute the coconut milk with another ingredient if I'm lactose intolerant?
c9f2,How can I adjust the spice level of the Fish Curry to suit my taste?
c9f2,What can I serve alongside the Fish Curry besides white rice?
c9f2,Is it possible to make this Fish Curry recipe in advance and reheat it later?
f8a1,Can I substitute the milk with a non-dairy alternative for the Oaty Pancakes recipe?
f8a1,What type of syrup pairs best with these Oaty Pancakes?
f8a1,How can I modify the recipe to make it gluten-free?
f8a1,"Is it possible to add fruits to the pancake batter, and if so, which ones work best?"
f8a1,"Can I prepare the batter in advance, and how should I store it until I'm ready to cook the pancakes?"
fd45,What type of tomato sauce works best for this Simple Sauce recipe?
fd45,Can I use a different type of mayonnaise if I want a healthier option?
fd45,How can I adjust the flavor of the sauce if I want it to be spicier?
fd45,What dishes would you recommend serving this Simple Sauce with?
fd45,How long can I store this Simple Sauce in the refrigerator?
9245,Can I substitute ground turkey for the beef and pork in the Basic Meatballs recipe?
9245,"What kind of breadcrumbs work best for these meatballs, and can I use gluten-free options?"
9245,How can I make the meatballs spicier if I prefer more heat in my dish?
9245,"What is the best way to store leftover meatballs, and how long will they last in the refrigerator?"
9245,"If I want to add more flavor, can I include any additional herbs or spices to the meatball mixture?"
afb2,What vegetables can I add to the Instant Tom Yam Kung noodle soup if I don't have salad leaves?
afb2,Can I use a different type of noodles instead of tom yam-quick noodles for this recipe?
afb2,"Is it possible to make this dish without eggs, and if so, what are the best substitutes?"
afb2,How can I adjust the spiciness level of the Tom Yam Kung noodle soup to suit my taste preferences?
afb2,"What is the best way to store any leftover soup, and how can I reheat it without compromising the flavor?"
d93e,"What type of wood should I use for smoking the Baby Back Ribs, and is there a substitute if I can't find applewood?"
d93e,How long should I let the barbecue rub sit on the ribs before smoking them?
d93e,"Can I add any additional seasonings or spices to the barbecue rub for more flavor, or should I stick to the recommended one?"
d93e,"What is the purpose of wrapping the ribs in tin foil during the cooking process, and how does it affect the taste and texture?"
d93e,"Is there a recommended side dish that pairs well with Baby Back Ribs, or any tips for serving them?"
64c3,"What type of Swiss cheese should I use for the fondue, and can I substitute one of them if I can't find Gruyère or Emmentaler?"
64c3,How can I make my fondue creamy and prevent it from becoming too thick or solid while serving?
64c3,"What type of white wine is recommended for this fondue, and does it need to be dry or sweet?"
64c3,"Can I add any additional ingredients or seasonings to the fondue for a unique flavor, such as herbs or spices?"
64c3,"How do I properly serve and enjoy the fondue to get the best experience, especially regarding the bread?"
5eaf,"What is the purpose of adding star anise and mace to the garam masala, and how do they affect the overall flavor?"
5eaf,How can I adjust the level of heat in the garam masala considering the cloves make it really hot?
5eaf,What is the best method for drying the spices if I live in a humid environment?
5eaf,"How fine should the garam masala powder be after mixing and sifting, and what should I do if it's not fine enough?"
5eaf,"How long can I store the garam masala, and what is the best way to ensure it stays fresh during that time?"
4257,What types of cream can I use besides high fat cream for the Crème brûlée recipe?
4257,"Can I substitute the brown sugar with white sugar, and will it affect the flavor?"
4257,How long can I store the Crème brûlée in the fridge after making it?
4257,Is there a method to prepare the Crème brûlée without a blowtorch for caramelizing the sugar on top?
4257,"Can I add any other flavors or ingredients, like chocolate or fruits, to the Crème brûlée without altering the original taste too much?"
45e9,What can I use as a substitute for the Mexican cornbread mix if I don't have it on hand?
45e9,Can I make this Southwestern Cornbread Salad vegetarian by omitting the bacon and cheese?
45e9,How can I adjust the spice level in the salad if I prefer it to be spicier?
45e9,What other toppings do you recommend adding to this salad for extra flavor and texture?
45e9,Is it possible to prepare this salad a day in advance and how should I store it?
6556,How long do I need to wait after pickling for the onions to turn vibrant pink?
6556,Can I add any specific herbs or spices to the pickling mixture for extra flavor?
6556,What type of vinegar works best for pickling red onions?
6556,How should I store the pickled red onions once they're done?
6556,Is there a way to speed up the cooling process for the pickling mixture?
9960,Can I use leftover chicken bones instead of a whole raw chicken for making chicken stock?
9960,What other vegetables can I add if I want to enhance the flavor of my chicken stock?
9960,How long can I store the chicken stock in the fridge or freezer after making it?
9960,"Is it necessary to skim the bubbles that form on top while simmering the stock, or can I skip that step?"
9960,What dishes can I use chicken stock in besides soup?
5b30,What type of tomatoes should I use for the best flavor in this pasta sauce?
5b30,"Can I substitute garlic for onion, or vice versa, in this recipe?"
5b30,How long should I simmer the sauce to achieve the perfect consistency?
5b30,Are there any specific dried herbs you recommend for making this sauce more flavorful?
5b30,Is it possible to make this sauce in larger batches and store it for later use?
8ca0,What type of pasta can I use if I don't have spaghetti on hand for the Pasta Alla Norma?
8ca0,Can I make Pasta Alla Norma without using olive oil or substitute it with another oil?
8ca0,How can I make this dish vegan-friendly if I want to leave out any dairy products?
8ca0,What's the best way to store leftover Pasta Alla Norma and how long will it last?
8ca0,Can I add any other vegetables to the Pasta Alla Norma to enhance its flavor or nutrition?
11ac,What can I serve with the Turkish Red Lentil Soup to enhance the flavor?
11ac,How do I adjust the recipe if I want to make it spicier than what is suggested?
11ac,Is there a vegetarian alternative for the vegetable broth that I can use for this recipe?
11ac,"Can I prepare the Turkish Red Lentil Soup in advance and store it? If so, how should I reheat it?"
11ac,What is the approximate nutritional value of the Turkish Red Lentil Soup per serving?
a6a8,What can I use as a substitute for sherry or white wine in the sauce for the Broccoli with Ginger and Garlic Sauce?
a6a8,How can I adjust the recipe for larger servings if I want to serve more than two people?
a6a8,What types of other vegetables can I use with this ginger and garlic sauce to create a variety of dishes?
a6a8,Is there a way to make the sauce spicier if I enjoy more heat in my dishes?
a6a8,"Can I prepare the ginger and garlic sauce in advance, and how should I store it if I do?"
d70e,"What type of milk should I use for the cream cheese recipe, and can I substitute UHT milk with fresh milk?"
d70e,"Is there a specific type of yogurt that works best for making cream cheese, or can I use any kind of yogurt?"
d70e,"How do I know when the mixture has reached the correct temperature of 80°C, and do I need a specific type of thermometer?"
d70e,What should I do if the whey doesn't seem to be dripping from the cheesecloth after pouring in the mixture?
d70e,"Can I add any additional flavorings or herbs to the cream cheese during the mixing process, and if so, when should I add them?"
c2d1,What kind of rice pairs best with the Stir Fried Chicken with an Orange Sauce?
c2d1,"Can I substitute any of the vegetables, like using green bell peppers instead of red?"
c2d1,"Is it possible to make this dish less sweet, and if so, how?"
c2d1,What can I use instead of butter to make this recipe dairy-free?
c2d1,"How long does the sauce take to thicken, and how can I tell when it's ready?"
a005,Can I use more than three bananas for a stronger banana flavor in the muffins?
a005,What type of dark chocolate should I use for the best flavor in these banana muffins?
a005,"Is it possible to substitute the butter with a dairy-free alternative, and if so, what would you recommend?"
a005,"How can I make these banana muffins healthier, perhaps by reducing sugar or using whole wheat flour?"
a005,"Do you have suggestions for additional ingredients to enhance the flavor, like nuts or spices, that pair well with chocolate and banana?"
a450,What can I substitute for kale if I don't have any on hand?
a450,Is there a way to make this Fennel White Bean and Kale Soup vegetarian or vegan?
a450,How can I adjust the spice level if I prefer a milder soup?
a450,"Can I make this soup ahead of time, and how should I store it?"
a450,What type of bread pairs best with this Fennel White Bean and Kale Soup for dipping?
738d,How strong will the Assam tea be if I use 3 teaspoons of tea instead of 2?
738d,Can I sweeten the Assam tea with honey instead of sugar?
738d,Is it possible to make Assam tea without any milk?
738d,How can I make a larger batch of Assam tea for more servings?
738d,What is the best type of milk to use for Assam tea if I want a creamier texture?
f8b9,Can I substitute elbow macaroni with another type of pasta if I have dietary restrictions?
f8b9,What can I use instead of fresh chili or bell peppers to make this dish less spicy?
f8b9,How can I adjust the recipe if I want to make it vegan?
f8b9,"Is there a way to make this dish quicker, perhaps by using canned lentils or pre-cooked rice?"
f8b9,What side dishes pair well with the Egyptian Lentils to make a complete meal?
ae88,What can I substitute for Feta Cheese if I want a dairy-free version of the Greek Salad?
ae88,"Can I add any additional vegetables to the Greek Salad, such as avocados or radishes, without compromising the dish's authenticity?"
ae88,How can I make this Greek Salad more filling for a larger meal?
ae88,"Is there a way to prepare this Greek Salad in advance, and if so, how can I store it properly?"
ae88,What kind of bread pairs well with the Greek Salad for a complete Mediterranean meal?
2347,What is the best way to adjust the spice level in Tunisian Couscous according to my taste preferences?
2347,"Can I use a different type of meat instead of lamb in this recipe, and how would that affect the cooking time?"
2347,What can I substitute for harissa if I can't find it at my local grocery store?
2347,"Are there any vegetarian alternatives for this Tunisian Couscous recipe, and how would the cooking process change?"
2347,How do I properly prepare and serve couscous to achieve the best texture and flavor for this dish?
6ed7,What adjustments can I make to the Lemon and oregano chicken traybake recipe if I want to make it gluten-free?
6ed7,"Can I use boneless chicken thighs instead of skin-on for this dish, and how would it affect the cooking time?"
6ed7,Is there a substitute for white wine in this recipe if I prefer not to use alcohol?
