id,questions
db9e,"What type of pasta is best to serve with Ragu Napoletano, and can I use something other than ziti, penne, or rigatoni?"
db9e,"Is there a way to adjust the spiciness of the Ragu Napoletano, and what ingredients should I add to achieve a milder flavor?"
db9e,"How do I properly form meatballs for this recipe, and is there a specific cooking method you recommend for them?"
578c,What can I use instead of lard or butter for a vegetarian version of Torta Frita Criolla?
578c,How long should I let the dough rest if I want to maximize the flavor of the Torta Frita?
578c,Can I add any sweet toppings or fillings to the Torta Frita before frying it?
578c,What herbs and spices would you recommend adding to the dough for extra flavor?
578c,"Is it possible to use whole wheat flour instead of all-purpose flour, and how would that affect the texture?"
58cd,"What additional ingredients can I use to customize my Salsa Verde, such as adding fruits or spices?"
58cd,"Can I make a spicier version of Salsa Verde, and if so, how can I adjust the heat level with different types of chilies?"
58cd,Is there a non-blender method to make Salsa Verde for those who don’t have kitchen appliances?
58cd,"How long can I store leftovers of Salsa Verde in the refrigerator, and can it be frozen for longer preservation?"
58cd,"What dishes pair well with Salsa Verde, and how can I incorporate it into my meals effectively?"
4e45,What type of lemons should I use for the best flavor in my Limoncello?
4e45,How long do I need to wait after infusing the lemons before I can enjoy my Limoncello?
4e45,"Can I adjust the sweetness of the Limoncello, and if so, how?"
4e45,Is there a recommended way to store the Limoncello once it's prepared?
4e45,What is the approximate alcohol content of the Limoncello once it's made?
cfb7,"What type of lamb should I use for the Slow-cooked Lamb with Lemon recipe, and can you suggest alternatives if I can't find lamb shoulder?"
cfb7,"How do I ensure my lamb stays moist and flavorful throughout the cooking process, especially if I'm using a different cut of lamb?"
cfb7,"Can I prepare the marinade for the lamb in advance, and how long should I ideally let the meat marinate before cooking?"
cfb7,"What vegetables can I add or substitute besides carrots, leeks, and potatoes in the Slow-cooked Lamb with Lemon dish?"
cfb7,Is there a specific way to store and reheat leftovers from this dish to maintain the flavor and texture?
2c9e,Can I substitute the extra firm tofu with a different type of tofu for this stir fry?
2c9e,What vegetables do you recommend for a richer flavor in the Tofu Stir Fry?
2c9e,"How can I make this dish gluten-free, especially regarding the sauce?"
2c9e,Is there a vegetarian alternative to the eggs for this recipe?
2c9e,What type of rice or noodles pair best with the Tofu Stir Fry?
36c1,What are the best types of potatoes to use for making Ukrainian Vareniki?
36c1,Can I substitute any ingredients for the sour cream if I want a dairy-free version?
36c1,How can I adjust the recipe if I want to make less than 45 servings?
36c1,What are some recommended sauces or toppings to serve with the Vareniki?
36c1,Is it possible to freeze the Vareniki after they are assembled but before cooking them?
24b4,"What kind of beef is best for Pho Soup, and can I use a different type of meat if I prefer?"
24b4,Is there a vegetarian or vegan alternative to the beef and beef bones in this Pho Soup recipe?
24b4,How can I adjust the spiciness of the Pho Soup to suit my taste preferences?
24b4,"What is the best way to store leftovers of Pho Soup, and how long will they last in the fridge?"
24b4,"Can I use store-bought broth instead of making my own with beef bones, and would it still taste authentic?"
5905,What types of grains are best to use in this sourdough recipe if I prefer a nutty flavor?
5905,Can I substitute any of the seeds in the recipe if I'm allergic to sesame?
5905,How can I adjust the fermentation time if the temperature in my kitchen is cooler than 25-30°C?
5905,What should I do if my sourdough starter didn't rise properly before using it in the bread?
5905,Is there a recommended way to store the baked sourdough bread to keep it fresh longer?
40a5,What is the best way to prepare the chicken for spatchcocking to ensure even cooking?
40a5,"Can I use fresh tarragon instead of dried for this Spatchcock Chicken recipe, and if so, how much should I use?"
40a5,What side dishes pair well with Spatchcock Chicken for a complete meal?
40a5,"Is it possible to marinate the chicken before spatchcocking it, and how would that affect the cooking time?"
40a5,What should I do if I don't have kitchen shears to spatchcock the chicken?
97f2,"What type of charcoal grill is best for smoking a turkey, and are there specific techniques I should use for indirect cooking?"
97f2,I prefer a more flavorful turkey; how can I enhance the taste beyond just using garlic powder in the butter?
97f2,"Can I use frozen vegetables instead of fresh mixed vegetables, and will it affect the cooking time?"
97f2,What should I do if my turkey doesn’t reach the recommended internal temperature of 160°F within the cooking time given?
97f2,Are there any sides that pair particularly well with smoked turkey that I could prepare simultaneously on the grill?
98a3,"What are the key ingredients I need to prepare Almeirim Stone Soup, and do you have any recommendations for substitutes if I can't find some of them?"
98a3,"Is the well-washed stone just for flavor, or does it play a crucial role in the cooking process of Almeirim Stone Soup?"
98a3,"Can I make Almeirim Stone Soup in advance, and if so, how should I store it to maintain its flavor and freshness?"
98a3,I'm trying to reduce fat in my diet; how can I adjust the recipe for Almeirim Stone Soup to make it lighter without sacrificing too much flavor?
98a3,What types of bread would pair well with Almeirim Stone Soup for a traditional Portuguese meal?
0be5,What type of beef roast is best for the Medieval Beef Soup to ensure it stays tender throughout the cooking process?
0be5,"Can I use vegetable stock instead of chicken stock in the Medieval Beef Soup, and will it affect the flavor significantly?"
0be5,What are some recommended spices I could add to the Medieval Beef Soup if I want a spicier flavor profile?
0be5,"If I can't find turnips with their greens, how exactly should I prepare Mustard greens as a substitute for the Medieval Beef Soup?"
0be5,How can I ensure that the beef and turnips are cooked perfectly without being mushy in the Medieval Beef Soup?
f340,Can I use a different type of meat instead of ham for the Schinkenfleckerl überbacken?
f340,What type of cheese is best for gratinating the top of the dish?
f340,Can I make this recipe vegetarian by omitting the meat?
f340,"How should I store leftovers, and how do I reheat them without drying out the dish?"
f340,"Is there a way to make this recipe spicier, and if so, what should I add?"
e3af,What type of potato should I use for making kettle chips to ensure they are crunchy?
e3af,How long should I cook the potato slices in the oil for the best texture?
e3af,"Is it necessary to use peanut oil, or can I substitute it with another oil for frying?"
e3af,"Can I customize the seasoning for the kettle chips, and if so, what are some suggestions?"
e3af,What should I do with the leftover frying oil after making the kettle chips?
f679,"Can I use different types of potatoes for the Rösti, or do I need to stick with firm/waxy ones?"
f679,What seasonings do you recommend adding to the Rösti mix for extra flavor?
f679,"Is there a vegetarian option for the Rösti, or can I omit the bacon if I want to keep it meat-free?"
f679,"How can I achieve a crispier Rösti, and what tips do you have for the cooking process?"
f679,What side dishes pair well with Rösti besides fried eggs and steamed peas/spinach?
08fa,What substitutions can I make if I don't have oat flakes on hand for the Country Crisp Cereals?
08fa,Can I use a different type of oil instead of the one suggested in the recipe for the Country Crisp Cereals?
08fa,How can I adjust the sweetness of the Country Crisp Cereals if I prefer them less sweet?
08fa,What kind of toppings or add-ins would you recommend to enhance the flavor of the Country Crisp Cereals?
08fa,Is there a way to make the Country Crisp Cereals gluten-free?
1696,"What type of meat can I use in my Okonomiyaki, and do you have any recommendations for a specific kind that works best?"
1696,"Can I add any additional vegetables or toppings to my Okonomiyaki, and are there any that you would recommend for a more unique twist?"
1696,What is the best way to ensure my Okonomiyaki gets a nice crispy exterior while keeping the inside fluffy?
1696,Do you have any tips for perfecting the sauce combination for my Okonomiyaki to enhance its flavor?
1696,How can I make this recipe gluten-free while still achieving a similar taste and texture in my Okonomiyaki?
2f80,What type of butter should I use for the best texture in the butter-based biscuits and cookies?
2f80,Can I substitute any ingredients if I want to make these biscuits and cookies dairy-free?
2f80,How can I adjust the baking time if I want my biscuits to be softer instead of crunchy?
2f80,Is there a specific way to shape the dough that can help with even cooking and texture?
2f80,"What is the significance of letting the dough cool in the fridge before baking, and what happens if I skip that step?"
135d,"What type of meat works best for the Beef Tips in Gravy, and can I use something other than round steak?"
135d,"Are there any low-fat alternatives for the sour cream in the mashed potatoes, or can I skip it entirely?"
135d,How can I adjust the seasoning if I prefer a spicier flavor profile for the gravy?
135d,"If I want to make this dish ahead of time, how should I store it after cooking, and how can I reheat it without overcooking the meat?"
135d,"Can I use a different type of cheese in the sour cream mashed potatoes, and how would that change the flavor?"
c940,What type of beef should I use for the Beef and Broccoli dish to ensure it's tender and flavorful?
c940,"Can I substitute any of the vegetables in the recipe, like using bell peppers instead of snow peas?"
c940,Is there a way to make the sauce spicier without sacrificing the original flavors of the dish?
c940,How do I adjust the cooking time if I want to make larger batches of Beef and Broccoli?
c940,What kind of rice pairs best with Beef and Broccoli to enhance the overall meal experience?
82e1,What kind of porkchops should I use for this French mustard sauce recipe?
82e1,Can I substitute white wine with something else if I don’t have any on hand?
82e1,How can I make this dish gluten-free while still keeping the flavor?
82e1,What side dishes pair well with French mustard sauce porkchops?
82e1,How do I know when the porkchops are fully cooked but still tender?
f219,"What kind of flour should I use for making Southern Biscuits, and can I substitute it with a gluten-free option?"
f219,How do I achieve the perfect flaky texture when making these biscuits?
f219,Can I add any additional ingredients like cheese or herbs to the Southern Biscuits recipe?
f219,What is the best way to store these biscuits after baking to keep them fresh?
f219,How can I tell when the biscuits are perfectly baked and ready to be taken out of the oven?
82cb,What can I substitute for bulghur wheat if I want a gluten-free option?
82cb,Can I use chicken thighs instead of chicken breasts for the Za'atar Chicken Bulghur Bowls?
82cb,How can I adjust the spice level of the dish if I prefer it to be less spicy?
82cb,What can I add to the bowl for extra protein besides chicken?
82cb,How long can I store leftovers of the Za'atar Chicken Bulghur Bowls in the fridge?
844d,What type of olives can I use if I don't have Kalamata olives for Baba's Feta Pasta?
844d,"Can I substitute the pasta with a gluten-free option, and if so, which type would work best?"
844d,What spices can I add to enhance the flavor of the dish if I want to try something different from mixed spice?
844d,"How can I adjust the recipe if I want to make it vegetarian-friendly, considering the use of chicken stock?"
844d,"Is it possible to make Baba's Feta Pasta in advance, and what is the best way to store it for later use?"
e212,What can I use as a substitute for flour if I'm gluten-free?
e212,Can I use a different type of syrup instead of maple syrup for this recipe?
e212,What other toppings or accompaniments would pair well with Grands-pères au sirop d'érable?
e212,How can I adjust the recipe if I want to make a larger batch?
e212,"Is there a way to make Grands-pères au sirop d'érable more flavorful, like adding spices or extracts?"
c77f,"Can I adjust the spice levels in the Fajita Seasoning, and if so, how?"
c77f,What types of meats can I use this Fajita Seasoning with?
c77f,Is there a way to make this seasoning mix without using sugar?
c77f,Can I use fresh herbs instead of dried ones in this Fajita Seasoning recipe?
c77f,"How long can I store this Fajita Seasoning mix, and what's the best way to keep it fresh?"
bc70,What vegetables can I use in Scouse if I don't have parsnips or swede?
bc70,Can I use a different type of meat instead of beef mince for the Scouse recipe?
bc70,How can I adjust the cooking time if I want to make a larger batch of Scouse?
bc70,"Is there a way to make Scouse gluten-free, and how would I modify the recipe?"
bc70,What can I serve alongside Scouse to make the meal more filling?
3562,"What kind of potatoes should I use for Shepherd's Pie, and how do they affect the texture of the dish?"
3562,Can I substitute the minced lamb with another type of meat or a vegetarian option while making Shepherd's Pie?
3562,"What is the purpose of adding paprika to the filling, and can I use a different spice if I don't have it?"
3562,How can I adjust the cooking time if I want to make a smaller batch of Shepherd's Pie for fewer servings?
3562,What sides or drinks would pair well with Shepherd's Pie for a complete meal experience?
bf0b,What alternative juice can I use if I can't find Cassis-Juice for the Glühwein?
bf0b,Can I use a different type of red wine other than Primitivo or Zinfandel in this recipe?
bf0b,What adjustments should I make to the recipe if I want to make a larger batch of Glühwein for more servings?
bf0b,"Is there a specific type of orange I should use for decorating the Glühwein, or will any type work?"
bf0b,How can I modify the sweetness of the Glühwein if I prefer it to be less sweet?
5067,Can I use a different type of sweetener instead of honey for the Honey Vanilla Ice Cream?
5067,What is the best way to store the ice cream after it has been made?
5067,Can I add mix-ins like chocolate chips or nuts to the ice cream while it's being churned?
5067,How do I prevent ice crystals from forming in my homemade ice cream?
5067,Is there a dairy-free alternative I can use for the heavy cream and milk in this recipe?
eba3,What other vegetables can I add to the Long-cooked Chuck Steak if I want to customize the flavor?
eba3,Can I use a different cut of beef instead of chuck steak for this recipe?
eba3,How can I adjust the seasoning to make this dish more flavorful while keeping it keto-friendly?
eba3,Is there a way to reduce the cooking time for the Long-cooked Chuck Steak without sacrificing tenderness?
eba3,What sides would pair well with this dish to make a complete meal?
3d36,What type of sausage can I use instead of Andouille in the Shrimp and Chicken Jambalaya recipe?
3d36,"Can I substitute the white rice with brown rice, and how would that affect the cooking time?"
3d36,"Is it possible to make this dish without shrimp, and if so, what adjustments should I make to the recipe?"
3d36,I have a spicy preference; can I increase the amount of cayenne pepper or add other spices to enhance the heat in the Jambalaya?
3d36,How can I adjust the recipe if I want to make it a vegetarian version of the Jambalaya?
4cf0,"What type of rice is best to use for Arroz Chaufa, and can I use leftover rice from another day?"
4cf0,Can I substitute chicken with another protein like shrimp or tofu in this recipe?
4cf0,How do I adjust the seasoning if the dish ends up too salty after adding soy sauce?
4cf0,Are there any necessary ingredients I can skip if I want to make a vegetarian version of Arroz Chaufa?
4cf0,"What kind of bell pepper works best in this dish, and should I use different colors for a more vibrant look?"
a790,Can I use a different type of mushroom besides button or crimini for the mushroom risotto?
a790,What type of white wine is best to use in this mushroom risotto recipe?
a790,Is it possible to make this risotto vegetarian by omitting the chicken stock?
a790,How can I adjust the recipe if I want to make a larger batch of mushroom risotto for a party?
a790,What can I substitute for Pecorino or Parmesan cheese if I have dietary restrictions?
4018,Can I substitute the boneless skinless chicken breasts with another protein or a vegetarian option?
4018,What type of rice pairs best with this chicken curry recipe?
4018,How can I adjust the spice level if I prefer a milder curry?
4018,Are there any recommended side dishes that would complement the Simple Chicken Curry?
4018,How can I store leftovers and how long will they last?
5633,What kind of bread can I use for the breadcrumbs if I want to make the patties gluten-free?
5633,How can I adjust the seasoning if I prefer a spicier flavor in my hamburger patties?
5633,What is the best way to store leftover patties if I make a larger batch than needed?
5633,"Can I substitute ground turkey or chicken for the ground beef in this recipe, and would the cooking time change?"
5633,What toppings or condiments do you recommend to complement the hamburger patties for a classic American style?
089d,Can I use steel-cut oats instead of large flake oats for the Hearty Breakfast Oatmeal?
089d,What non-dairy milk options would work well in this recipe if I want to make it dairy-free?
089d,How can I adjust the sweetness of the oatmeal if I prefer a sweeter breakfast?
089d,"Is it possible to make this oatmeal vegan by substituting the egg and protein powder, and if so, what can I use?"
089d,"Can I add other fruits or toppings to the oatmeal, and which ones would complement it best?"
8a57,How much salt should I add to the boiling water for pasta to enhance its flavor?
8a57,What type of pasta sauce pairs well with store-bought pasta?
8a57,"Can I add herbs or spices to the pasta while it cooks, or is it better to add them afterward?"
8a57,What is the recommended cooking time for different types of pasta to achieve that perfect al dente texture?
8a57,Is there a specific amount of butter I should use when mixing it with the pasta after straining?
3aa3,What type of cheese do you recommend for making a quesadilla to achieve an authentic taste?
3aa3,Can I use whole wheat tortillas instead of regular ones for a healthier option?
3aa3,"Are there any specific vegetables that work best in a quesadilla, or can I use any that I have at home?"
3aa3,How long should I cook the quesadilla on each side to ensure it's perfectly golden brown?
3aa3,"Is it necessary to add oil when cooking the quesadilla, or can I skip it for a healthier version?"
3c6b,What can I substitute for the Italian sausage if I prefer a leaner meat option?
3c6b,Can I use gluten-free spaghetti instead of regular pasta for this recipe?
3c6b,How can I make the sauce spicier without compromising the overall flavor?
3c6b,What should I do if I don't have fresh herbs like basil and parsley for the sauce?
3c6b,Is it possible to prepare the meatballs ahead of time and freeze them for later use?
72e8,How ripe should the pears be for the best flavor in the Belgian pear syrup?
72e8,"Can I substitute dried fruits for any fresh fruits in this recipe, and how would it affect the flavor?"
72e8,What should I do if I don't have a sieve or cheese cloth to strain the syrup?
72e8,How long can I store the Belgian pear syrup after sealing it in jars?
72e8,What are some suggested uses for the Belgian pear syrup besides spreading it on bread?
7f35,"What type of fresh herbs should I use for Aljotta, and can I substitute any of them?"
7f35,"Is there a specific type of fish that is best for making Aljotta, or can I use whatever I have at home?"
7f35,How can I adjust the thickness of the Aljotta soup if I want it to be less dense?
7f35,What are some ways to serve Aljotta besides the traditional olive oil and lemon squeeze?
7f35,"Can I use leftover fish stock from another recipe to make Aljotta, and will it affect the flavor?"
79d8,Can I use quick oats instead of regular oatmeal for the banana and oatmeal cookies?
79d8,What can I substitute for honey if I want a vegan option?
79d8,"How many cookies does this recipe yield, and can I easily double the recipe for more servings?"
79d8,What spices can I add to the banana and oatmeal cookies besides cinnamon for extra flavor?
79d8,How should I store the cookies to keep them fresh for longer?
235a,What kind of spices do you recommend mixing into the flour for the chicken tenders?
235a,Can I use a different type of oil instead of olive oil for coating the chicken tenders?
235a,How do I know when the chicken tenders are fully cooked after air frying them?
235a,"Is it possible to make this recipe gluten-free, and if so, what substitutions should I use?"
235a,What dipping sauces go well with air-fried chicken tenders besides honey mustard?
77f3,"What type of cheese is recommended for Älplermagronen, and can I use another type if Appenzeller is not available?"
77f3,"How many servings does the Älplermagronen recipe yield, and can I easily scale it up for a larger group?"
77f3,"Can I use a different type of pasta instead of macaroni for this dish, and how will it affect the cooking time?"
77f3,Are there any specific tips for achieving the right creamy texture in Älplermagronen if my cheese doesn't melt well?
77f3,"Is there a particular brand of apple sauce that pairs best with Älplermagronen, or can I use homemade apple sauce?"
b792,"What type of rice works best for this recipe, and do I need to rinse it before cooking?"
b792,Can I use vegetable broth instead of chicken stock for a vegetarian option?
b792,What are some spices I can add to enhance the flavor of the rice beyond just onion and garlic?
b792,"Is there a specific type of onion that works best in this rice recipe, or can I use any kind?"
b792,How do I adjust the cooking time if I'm making a larger batch of rice in the same pot?
67fe,Can I substitute Greek yogurt for mayonnaise in this coleslaw recipe to make it healthier?
67fe,What other vegetables can I add to the coleslaw besides cabbage and carrot?
67fe,"How long can I store the leftover dressing from this coleslaw, and can I use it with other salads?"
67fe,What would be a good main dish to serve alongside this coleslaw for a summer barbecue?
67fe,Is there a way to make this coleslaw spicier without overwhelming the original flavor?
6c24,"What type of wine should I use for the red wine vinegar sauce, and can I substitute it with something else?"
6c24,How can I make this recipe healthier while still keeping the same flavors?
6c24,What side dishes pair well with Chicken in Red Wine Vinegar Sauce?
6c24,"Can I use boneless chicken breasts instead of a whole chicken for this recipe, and how would the cooking time change?"
6c24,Are there any recommendations for using leftovers from this dish in another meal?
9efd,"What type of beef cuts work best for Stoofvlees, and are there any specific brands you recommend?"
9efd,"Can I use a different type of beer if I don't have brown beer, and how might it change the flavor?"
9efd,"Is there a vegetarian substitute I can use instead of beef, and how would that affect the cooking time?"
9efd,"What are the best side dishes to serve with Stoofvlees, besides fries and chicory salad?"
9efd,"How do I store leftovers of Stoofvlees, and how long will they last in the fridge?"
3468,"What type of flour is best to use for the no-knead pizza dough, and can I substitute it with whole wheat or gluten-free flour?"
3468,"How long should I let the dough rise before it’s ready for baking, and is there a specific temperature I should keep it at?"
3468,"Can I add different herbs or spices to the dough, and how might that affect the overall flavor of the pizza?"
3468,"What is the ideal way to store the dough in the refrigerator if I want to prepare it in advance, and how long will it last?"
3468,"If I want to make multiple pizzas, can I adjust the recipe, and how would the rising time change with larger batches?"
6069,What type of apples are best for making the Apple Pie?
6069,Can I use a different kind of sugar instead of white and brown sugar?
6069,How can I make the crust more flaky for the Apple Pie?
6069,Is there a way to make the Apple Pie filling less sweet?
6069,What can I substitute for the egg wash if I want to keep the pie vegan?
243a,What can I use as a substitute for lean ground beef in the Pastítsio recipe?
243a,Can I prepare the meat layer in advance and store it in the fridge before assembling the Pastítsio?
243a,How can I make the béchamel sauce healthier without compromising the taste of the Pastítsio?
243a,What type of cheese is recommended for topping the Pastítsio for the best flavor?
243a,Are there any recommended side dishes that go well with Pastítsio for a complete Greek meal?
5d08,What is the purpose of soaking the chicken in saltwater before roasting?
5d08,Can I use other types of seasoning besides pepper and salt for the chicken breast?
5d08,How long should I let the chicken breast rest after removing it from the oven?
5d08,What should the internal temperature be before serving the chicken to ensure it's safe to eat?
