id,questions
83f4,"What type of potatoes are best for making creamy mashed potatoes, and do you recommend any specific variety?"
83f4,"Can I use a substitute for mayonnaise in the recipe, and if so, what would you suggest for a similar creamy texture?"
83f4,"How can I adjust the recipe if I want to make it vegan or dairy-free, especially considering the cheese and milk ingredients?"
83f4,"What can I do to make the mashed potatoes extra cheesy without overwhelming the flavor, and how much more cheese should I add?"
83f4,"Is it possible to prepare the creamy mashed potatoes in advance, and if so, how should I store and reheat them to maintain their creaminess?"
f114,What can I substitute for salt pork if I can't find it in my local store?
f114,How should I adjust the cooking time if I want to make a smaller batch of the red sauce?
f114,"Can I use fresh tomatoes instead of canned tomatoes, and if so, how would that affect the recipe?"
f114,What are some ideal dishes to pair with this red sauce besides pasta?
f114,Is there a way to make this sauce healthier without sacrificing flavor?
5a90,Can I use whole wheat flour instead of white flour for the Turmeric Flatbread?
5a90,What type of olive oil works best for making Turmeric Flatbread?
5a90,Is there a way to make the Turmeric Flatbread vegan-friendly?
5a90,How can I store leftover Turmeric Flatbread and for how long will it stay fresh?
5a90,What are some suitable toppings or dips that pair well with Turmeric Flatbread?
0b3f,Can I substitute the beef with chicken or another type of meat for the Zurich-Style Meat Saute?
0b3f,What kind of white wine is best to use in this recipe for the best flavor?
0b3f,Is there a way to make this dish dairy-free while still keeping it creamy?
0b3f,How can I adjust the cooking time if I'm using thicker slices of beef instead of finely sliced?
0b3f,What traditional Swiss dishes pair well with Zurich-Style Meat Saute besides Rösti?
bacf,What type of pork roast should I use for the Tuscan Style Pork Roast?
bacf,Can I use dried herbs instead of fresh rosemary for this recipe?
bacf,How long should I let the pork roast rest after cooking before slicing it?
bacf,What is the best way to ensure the pork roast is cooked evenly throughout?
bacf,Can I substitute pancetta with a different type of meat or ingredient if I can't find it?
e371,What type of pasta can I use if I don't have linguine?
e371,Can I substitute the smoked salmon with another type of fish or protein?
e371,Are there any alternative vegetables I can add if I don't like asparagus or green beans?
e371,How can I make this dish gluten-free while keeping the same flavors?
e371,What is the best way to store leftovers of the Smoked Salmon Pasta Primavera?
0726,"What type of chili sauce can I use to make Spicy Mayo, and does it make a difference in flavor?"
0726,"Can I substitute mayonnaise with a healthier alternative, such as Greek yogurt, and how would that change the recipe?"
0726,How can I adjust the spiciness of the Spicy Mayo to better suit my taste preferences?
0726,"What is the best way to store leftover Spicy Mayo, and how long can I keep it in the refrigerator?"
0726,"Can I add any additional ingredients to the Spicy Mayo to enhance its flavor, like garlic or lime juice?"
c59f,Can I use a different type of rice instead of Pama porridge rice for making Risengrød?
c59f,What are some alternatives for the butter if I want to make this dish dairy-free?
c59f,How can I adjust the sweetness of the Risengrød if I prefer it less sweet?
c59f,Is there a way to make Risengrød in a rice cooker instead of on the stove?
c59f,What are some traditional toppings for Risengrød besides cinnamon sugar and butter?
b902,"What type of meat can I use for the Pilaf besides lamb, and will it change the flavor significantly?"
b902,"Can I substitute the long grain rice with another type of rice, and if so, how will that affect the cooking time?"
b902,"I have dietary restrictions regarding salt; can I reduce the amount used in this Pilaf recipe, and will it still taste good?"
b902,"What optional ingredients do you recommend to enhance the flavor of the Pilaf, and how much of each should I use?"
b902,How can I ensure that the rice in the Pilaf is perfectly cooked and doesn't become mushy or undercooked?
94ba,"What type of yeast should I use for the Italian bread, and how do I activate it?"
94ba,"Can I use all-purpose flour instead of bread flour, and will it affect the texture of the bread?"
94ba,"Is there a specific reason to add salt to the dough, and what happens if I skip it?"
94ba,"How can I tell when the dough has risen sufficiently, and what temperature is ideal for rising?"
94ba,Do you have any tips for achieving a crispy crust on the Italian bread after baking?
f343,What can I use as a substitute for milk in the pancake recipe if I'm lactose intolerant?
f343,How can I modify the pancake recipe to make it gluten-free?
f343,Are there any tips for making the pancakes fluffier?
f343,What toppings would you recommend to add more flavor to the pancakes?
f343,How can I adjust the recipe to make enough pancakes for multiple servings instead of just one?
a844,"What type of black tea is best for making Tanzanian Tea w/ Milk, and where can I find it?"
a844,"Can I use non-dairy milk alternatives for this recipe, and will it still taste good?"
a844,How long should I let the tea seep for the strongest flavor without it becoming too bitter?
a844,"What are some recommended sweeteners for this drink, and how much should I use based on my preference for sweetness?"
a844,Is there a way to prepare this Tanzanian Tea w/ Milk for multiple servings if I want to share it with friends?
98eb,"What type of cheese is best to use for the Cheesy Potato Bake, or can I mix different cheeses?"
98eb,Can I substitute the butter with olive oil or a dairy-free alternative for a healthier option?
98eb,How can I make the Cheesy Potato Bake spicier or add more flavor to the dish?
98eb,Is there a way to prep the potatoes in advance so they don't turn brown before baking?
98eb,What side dishes would go well with the Cheesy Potato Bake for a complete meal?
d807,How can I make my spaghetti aglio e olio spicier without overpowering the garlic flavor?
d807,"Is there a particular type of pasta that works best for this dish, or can I use any shape?"
d807,What can I substitute for fresh parsley if I don't have any on hand?
d807,"Can I add protein to this dish, and if so, what would pair well with spaghetti aglio e olio?"
d807,What is the best way to prevent the garlic from burning while cooking it in the olive oil?
f2df,Can I substitute quark with something else if I can't find it at my local store?
f2df,What is the best temperature for frying the Quarkbällchen to ensure they are cooked properly?
f2df,How can I adjust the sweetness of the Quarkbällchen if I prefer a less sweet dessert?
f2df,Is there a specific type of alcohol that works best to prevent the fried quark balls from becoming greasy?
f2df,"How do I store leftover Quarkbällchen, and how long do they typically last?"
10a1,Can I substitute the ground pork with a different protein like chicken or beef for the Mapo Tofu?
10a1,What adjustments should I make if I want to make a vegetarian version of Mapo Tofu?
10a1,How can I make the dish less spicy while still keeping the flavor of the Mapo Tofu?
10a1,"What type of rice pairs best with Mapo Tofu, and how should I prepare it?"
10a1,Is there a way to enhance the numbing flavor of the dish without adding more Sichuan peppercorns?
7ebd,What can I use instead of ground beef for a vegetarian version of Chili Con Carne?
7ebd,How can I adjust the spice level if I prefer a milder chili?
7ebd,Can I substitute fresh tomatoes for canned whole peeled tomatoes in this recipe?
7ebd,What sides pair well with Chili Con Carne for a complete meal?
7ebd,"Is it possible to make Chili Con Carne in a slow cooker, and if so, how would the directions change?"
8056,What is the best way to reduce the strong taste of liver for someone who is not a fan of it?
8056,How do I know when the liver is cooked properly without overcooking it?
8056,"Can I use different types of onions, or do you recommend a specific variety for this recipe?"
8056,What other vegetables can I add to the dish to make it healthier?
8056,Is there a specific seasoning or spice blend that works particularly well with liver and onions?
e7c4,"Can I substitute falukorv with another type of sausage, and if so, which ones would work best?"
e7c4,What can I use instead of cream for a lighter version of Korv Stroganoff?
e7c4,How can I make this dish gluten-free considering the soy sauce and other ingredients?
e7c4,What are some recommended side dishes that pair well with Korv Stroganoff besides boiled rice?
e7c4,How do I adjust the cooking time if I want to double the recipe for more servings?
b185,What is the best way to enjoy naan bread with different types of curries?
b185,Can I use whole wheat flour instead of all-purpose flour for this naan recipe?
b185,How do I store leftover naan bread to keep it fresh?
b185,What are some good toppings or seasonings I can add to the naan before baking?
b185,Is there a gluten-free alternative I can use for the naan if I'm avoiding gluten?
53d2,What is the best type of ground beef to use for Steak Tartare to ensure it's safe and flavorful?
53d2,Can I substitute any ingredients if I don’t have capers or cornichons on hand?
53d2,How long can I keep the raw Steak Tartare in the refrigerator before it should be eaten?
53d2,What are some recommended side dishes or accompaniments that would pair well with Steak Tartare?
53d2,Is there a specific way to serve the egg yolk on top of the Steak Tartare for presentation purposes?
cddf,What type of beer pairs best with Hangover Eggs for an authentic experience?
cddf,"Can I substitute any of the ingredients, like the French bread or olive oil, for healthier options?"
cddf,How can I adjust the spice level in the Hangover Eggs for someone who prefers milder flavors?
cddf,Are there any suggested variations to the recipe if I'm cooking for a larger group?
cddf,What is the best method to ensure the eggs are cooked perfectly while avoiding overcooking?
3c3e,What type of salmon is best to use for this baked salmon recipe?
3c3e,Can I use a different type of seasoning instead of red pepper flakes?
3c3e,What can I serve with this baked salmon to make a complete meal?
3c3e,How can I adjust the baking time if I have thicker salmon steaks?
3c3e,Is it possible to make this recipe without using aluminum foil?
40e6,Can I substitute the butter with a plant-based alternative for a dairy-free version?
40e6,What is the best way to store leftover oatmeal cookies to keep them fresh?
40e6,"Can I use quick oats instead of rolled oats, and will it affect the texture of the cookies?"
40e6,How can I adjust the recipe to make these cookies gluten-free?
40e6,What is the recommended baking time if I decide to make smaller or larger cookies?
7332,What type of apple is best to use for the Spiced Apple Pancakes to enhance their flavor?
7332,Can I substitute the all-purpose flour with a gluten-free flour option in the Spiced Apple Pancakes recipe?
7332,How can I make the Spiced Apple Pancakes dairy-free without compromising the taste?
7332,What toppings would you recommend to complement the Spiced Apple Pancakes for a delicious breakfast?
7332,"Is there a way to make the Spiced Apple Pancakes healthier, perhaps by reducing sugar or using alternative sweeteners?"
5745,"Can I use a different type of meat besides beef for this jerky recipe, and if so, what should I be cautious about?"
5745,"What kind of beef cuts are best for making jerky, and does it affect the flavor or texture?"
5745,"How long should I marinate the beef for the best flavor, and is overnight marinating necessary?"
5745,What are some additional seasonings I could use to customize the flavor of the jerky if I don't want it to be too salty?
5745,"Can I use a conventional oven to dry the jerky, and what specific temperature and timing do you recommend for that method?"
a458,"What type of milk should I use for making cheese, and can I use something other than cow's milk?"
a458,How long do I need to let the cheese rest after cutting it into squares?
a458,Is there a specific temperature I need to maintain when heating the milk for this cheese recipe?
a458,What is the purpose of using oil and vinegar during the aging process?
a458,Can you suggest some ways to use the whey leftover after making the cheese?
1c43,"What type of flour is best suited for making ravioli, and can I use all-purpose flour instead of 00 flour?"
1c43,How can I tell when the ravioli are cooked properly in boiling water?
1c43,Can I substitute the ricotta cheese with something else if I want a dairy-free version?
1c43,"What variations can I make to the seafood filling besides lobster and crab, and can I add vegetables?"
1c43,What sauce recommendations pair well with the seafood version of the ravioli?
6d72,What type of Italian red wine is best to use for the Mulled Wine recipe?
6d72,Can I substitute the limoncello with another citrus liqueur if I don't have it?
6d72,How can I adjust the sweetness of the Italian Mulled Wine if I prefer it less sweet?
6d72,"What other fruits can I add to enhance the flavor of the Italian Mulled Wine, besides orange and lemon?"
6d72,Is there a way to make this recipe non-alcoholic while still retaining some of the flavor profiles?
adbf,Can I use fresh beans instead of canned beans for the refried beans recipe?
adbf,What type of paprika is best for adding flavor to my refried beans?
adbf,Is it possible to make refried beans without butter for a vegan option?
adbf,How can I adjust the recipe if I want to make a larger batch of refried beans?
adbf,What can I serve with refried beans besides totopos?
a17e,Can I substitute the butter with a dairy-free alternative for a vegan version of the Fall Vegetable and Chickpea Curry?
a17e,What type of rice pairs best with the Fall Vegetable and Chickpea Curry for a complete meal?
a17e,Is there a way to make this curry spicier for those who enjoy more heat in their dishes?
a17e,"Can I add additional vegetables or legumes to the Fall Vegetable and Chickpea Curry, and if so, which ones would work well?"
a17e,How can I thicken the sauce if it turns out too watery after cooking the Fall Vegetable and Chickpea Curry?
4b91,"What type of mushrooms work best for the Winter Risotto, and can I substitute them with something else if I don't have them?"
4b91,"Is there a way to make the Winter Risotto vegan, and what alternatives can be used for the Parmesan cheese?"
4b91,"Can I make this Winter Risotto ahead of time, and how should I reheat it while keeping the texture creamy?"
4b91,What can I do to adjust the seasoning if the Winter Risotto is too bland for my taste?
4b91,"Is it possible to add protein to the Winter Risotto, like chicken or tofu, without affecting the dish's overall balance?"
70df,"What type of potatoes work best for Parmesan potatoes, and can I use different kinds for a different texture?"
70df,Can I use olive oil instead of butter when frying the potatoes for a healthier option?
70df,What are some alternative herbs I can use if I don't have rosemary on hand for the Parmesan potatoes?
70df,Do you have any tips for perfectly crispy potatoes when frying them?
70df,"Can I make Parmesan potatoes ahead of time and reheat them later, or do they taste best fresh?"
930c,What can I use as a substitute for flour if I want to make gluten-free Swedish pancakes?
930c,Can I add any spices or flavorings to the batter for extra taste in the Swedish pancakes?
930c,What type of syrup do you recommend for serving with Swedish pancakes – maple syrup or something else?
930c,How can I make the pancakes fluffier? Should I adjust the milk or eggs in the recipe?
930c,Can I prepare the batter in advance and store it in the refrigerator before cooking the pancakes?
4ab9,What type of tomatoes should I use for the Chicken Parmesan to get the best flavor?
4ab9,"Is it necessary to pound the chicken breasts, and what is the ideal thickness for them?"
4ab9,Can I use a different type of cheese if I don't have mozzarella or parmesan?
4ab9,How can I make sure that the breading stays crispy when serving the Chicken Parmesan?
4ab9,What are some recommended side dishes to serve with Chicken Parmesan?
ffc8,"What type of flour should I use for the Red Bean Buns, and can I substitute it with a gluten-free option?"
ffc8,How can I adjust the sweetness of the red bean paste if I prefer it less sweet?
ffc8,"What is the best way to store leftover Red Bean Buns, and how long will they stay fresh?"
ffc8,Can I make the bun dough in advance and refrigerate it before shaping the buns?
ffc8,Are there any common variations of ingredients or fillings for Red Bean Buns that I could try?
ed64,What can I use instead of tapioca if I don’t have it on hand for the omelet?
ed64,Can I substitute the Cheddar cheese with another type of cheese for a different flavor in my cheese omelet?
ed64,How can I make this omelet recipe dairy-free if I want to avoid milk and butter?
ed64,What is the best way to ensure my egg whites are beaten stiff enough for the omelet?
ed64,"Can I add vegetables or herbs to this omelet recipe, and if so, when should I incorporate them?"
b07e,How do I know when the sausages are fully cooked for the Aussie Snags?
b07e,Can I use other types of sausages besides thin pork sausages for this dish?
b07e,What type of oil works best for grilling the onions in the sausage sizzle?
b07e,Is there a vegetarian alternative I can use instead of sausages for this recipe?
b07e,What can I do to add a bit more flavor to the onions when cooking them for the Aussie Snags?
48f1,"What type of beef is best to use for making Bitoque, and can I substitute sirloin steak with another cut?"
48f1,Can you suggest a type of beer that pairs well with the Bitoque sauce?
48f1,Is there a specific way to season the steaks before cooking to enhance the flavor profile of the dish?
48f1,What side dishes do you recommend serving with Bitoque for a complete meal?
48f1,Are there any tips for achieving the perfect runny yolk on the fried eggs to complement the steak and sauce?
eff2,What type of pasta sheets are recommended for this lasagna recipe?
eff2,Can I use any other cheese besides Parmesan and Emental in this recipe?
eff2,"Is it possible to make the Bolognese sauce from scratch, and what ingredients are needed for that?"
eff2,How can I modify the recipe to make a vegetarian version of lasagna?
eff2,What should I do if I want to make this lasagna in advance and reheat it later?
3652,"What type of potatoes work best for Irish Potato Casserole, and can I use any alternatives if I don't have the recommended type?"
3652,"Is there a way to make this casserole ahead of time, and if so, how would you recommend storing and reheating it?"
3652,"Can I substitute the sharp cheddar cheese for a different type of cheese, and would that change the flavor significantly?"
3652,Are there any additional ingredients I can add to this casserole to enhance the flavor or add more nutrition?
3652,"How do I know when the casserole is fully cooked, and what should the texture look like before serving?"
5a5b,"What type of milk is best to use for making Greek yogurt, whole or low-fat?"
5a5b,Can I use flavored yogurt instead of plain yogurt to start the fermentation process?
5a5b,How long should the yogurt ferment in the thermos if I want a milder flavor?
5a5b,"Is it necessary to wash the thermos with boiling water, or can I skip that step?"
5a5b,What can I do if my yogurt doesn't thicken after the 12-hour fermentation period?
2a04,What type of cracked wheat should I use for the Tabouleh recipe?
2a04,Can I substitute any of the fresh herbs if I don't have mint or parsley?
2a04,What other vegetables can I add to the Tabouleh for extra flavor or texture?
2a04,"How can I adjust this recipe for a smaller serving size, like for 4 people?"
2a04,"What is the best way to store leftover Tabouleh, and how long will it last?"
32cb,Can I use fresh plums instead of dried plums for this spread?
32cb,What type of bread pairs best with the dried tomato & plum spread?
32cb,Is there a way to make this spread vegan-friendly?
32cb,How long can I store the dried tomato & plum spread in the fridge?
32cb,Can I add nuts to the spread for extra texture and flavor?
7128,"What type of shrimp should I use for the Shrimp and Grits recipe, and can I use frozen shrimp instead of fresh?"
7128,"Can I substitute the cheddar cheese with another type of cheese for a different flavor, and if so, which ones work best?"
7128,"Is there a way to make this Shrimp and Grits recipe healthier, perhaps by reducing the amount of bacon or using a different cooking method?"
7128,"How can I adjust the recipe to serve more than 3 people, and what is the best way to scale the ingredient quantities?"
7128,"What can I add to the Shrimp and Grits for extra flavor without overpowering the dish, such as additional spices or vegetables?"
7c53,"What type of flour is best for making Cuca Italiana, all-purpose or something else?"
7c53,Can I substitute lard or butter in the recipe with a vegan option?
7c53,"What is the best way to ensure the crumbly top, or 'farofa', turns out perfect?"
7c53,How long should I let the dough rise for optimal texture and flavor?
7c53,What fruit jams or toppings pair best with Cuca Italiana for serving?
ac85,Can I use egg substitutes instead of real eggs for the frittata?
ac85,"What kind of cheese do you recommend for the frittata, and how much should I use?"
ac85,Are there any vegetarian options for the meat component in the frittata?
ac85,"How can I ensure my frittata doesn't turn out too watery, especially if I'm adding tomatoes?"
ac85,What other vegetables do you suggest if I want to customize my frittata beyond onions and bell peppers?
7b09,What can I use as a substitute for ground beef in the Panang-Style Beef Curry recipe if I want a vegetarian option?
7b09,How spicy is this dish with the red chili pepper? Can I adjust the heat level without compromising the flavor?
7b09,"Is it possible to prepare the Panang-Style Beef Curry in a slow cooker, and if so, what adjustments should I make to the cooking time?"
7b09,"Can I use a different type of rice instead of jasmine rice, and how will it affect the overall taste of the dish?"
7b09,"What can I do with any leftovers from the Panang-Style Beef Curry, should I refrigerate or freeze them, and how long will they last?"
0268,"What ingredients do I need to make the Chipolata Sausage in Balsamic Vinegar dish, and do you have any recommendations for alternatives to cherry tomatoes?"
0268,"Can I use a different type of bread instead of ciabatta, and how would that affect the dish?"
0268,Is there a specific type of balsamic vinegar that you recommend for this recipe to enhance the flavor?
0268,How can I adjust the cooking time if I want to double the recipe for a larger group?
0268,Are there any side dishes or wines that pair particularly well with Chipolata Sausage in Balsamic Vinegar?
92a0,What are the best practices to ensure my Zopf bread rises properly during the one-hour resting period?
92a0,"Can I substitute any ingredients in the Zopf recipe, like using almond milk instead of regular milk?"
92a0,What are some ways to enhance the flavor of the Zopf bread while maintaining its traditional characteristics?
92a0,"Is it possible to make Zopf bread ahead of time, and if so, how should I store it to maintain freshness?"
92a0,What are some recommended toppings or spreads that go well with Zopf bread?
6a80,What type of milk should I use to make ricotta if I don't have whey on hand?
6a80,How do I know when the milk has reached the right temperature of 80°C?
6a80,Is there a specific type of cheesecloth I should use for straining the ricotta?
6a80,Can I use lime juice instead of lemon juice for the citric acid in this recipe?
6a80,How long can I store the ricotta in the fridge once it's made?
edc2,What can I use instead of sesame oil for frying the chicken if I don't have any?
edc2,"Can I make a vegetarian version of the Asian Style Chicken with Sticky Sauce, and what could I substitute for the chicken?"
edc2,What are some recommended side dishes to serve along with this Asian Style Chicken to complement the meal?
edc2,How can I adjust the sweetness of the sauce if I prefer a less sweet dish?
edc2,Is there a way to make the chicken healthier while maintaining the crispy texture in this recipe?
0800,"What kind of pasta can I use for the Shrimp Fettuccine Alfredo, and does it affect the taste?"
0800,"If I wanted to make the sauce a bit thinner, how much additional milk should I add to the recipe?"
0800,"Can I substitute the shrimp with another protein, and if so, what would be a good alternative?"
0800,"How long can I store the leftovers of the Shrimp Fettuccine Alfredo in the freezer, and how should I reheat it?"
0800,"Is there a way to add more flavor to the Alfredo sauce without increasing the thickness, such as spices or herbs?"
b55d,What type of lettuce is best for making Caesar Salad?
b55d,Can I add grilled chicken or shrimp to my Caesar Salad for extra protein?
b55d,What alternatives can I use for Caesar Salad dressing if I prefer a lighter option?
b55d,How can I make homemade croutons for my Caesar Salad?
b55d,Is there a vegetarian alternative to Parmesan cheese that works well in Caesar Salad?
06e2,"What type of dashi stock should I use for the Miso-soup, and can I make it from scratch?"
06e2,Can I add other vegetables to the Miso-soup besides tofu and seaweed?
06e2,How long should I boil the ingredients before adding the miso paste?
06e2,What kind of miso paste is best for a traditional flavor in Miso-soup?
06e2,Is there a vegetarian alternative to dashi stock that I can use in this recipe?
